{
	"zweck": "Umschalter für eine sofort wirksame Ein/Aus-Einstellung (Web-Variante). Track wechselt die Farbe, der weiße Thumb wandert. iOS nutzt das native Plattform-Control.",
	"status": "ready_for_dev",
	"callouts": [
		{
			"nr": 1,
			"text": "Track — 26×16, voll gerundet; Farbe signalisiert On (Text-100) bzw. Off (Background-20)."
		},
		{
			"nr": 2,
			"text": "Thumb — weißer 12px-Kreis, wandert im On-Zustand nach rechts."
		}
	],
	"a11y": [
		{
			"label": "Rolle",
			"wert": "Als <button role=switch> mit aria-checked umsetzen.",
			"status": "warn"
		},
		{
			"label": "Tastatur",
			"wert": "Leertaste/Enter schaltet um.",
			"status": "pass"
		},
		{
			"label": "Fokus",
			"wert": "Sichtbarer Fokus-Ring in Focus-100.",
			"status": "pass"
		},
		{
			"label": "Zustand",
			"wert": "On/Off nicht allein über Farbe — aria-checked + ggf. Text.",
			"status": "warn"
		},
		{
			"label": "Plattform",
			"wert": "iOS nutzt das native Switch-Control (nicht diese Web-Variante).",
			"status": "todo"
		}
	],
	"tastatur": [
		{
			"taste": "Tab",
			"aktion": "Setzt den Fokus auf den Umschalter."
		},
		{
			"taste": "Leertaste / Enter",
			"aktion": "Schaltet zwischen On und Off um."
		}
	],
	"doDont": {
		"do": [
			"Für Einstellungen, die sofort greifen (kein Speichern nötig).",
			"Mit klarem Label, das den Ein-Zustand beschreibt."
		],
		"dont": [
			"Nicht in Formularen, die erst per Absenden gespeichert werden — dafür Checkbox.",
			"Nicht ohne Label allein stehen lassen."
		]
	},
	"verwendung": {
		"nutzen": [
			"Sofort wirksame Ein/Aus-Einstellungen (Dark Mode, Benachrichtigungen).",
			"Binäre Zustände mit unmittelbarer Wirkung."
		],
		"nichtNutzen": [
			"Mehrfachauswahl oder Zustimmung im Formular — dafür Checkbox.",
			"Mehr als zwei Zustände — dafür Segmented Control/Radio."
		]
	},
	"wording": [
		{
			"schlecht": "Modus",
			"gut": "Dunkles Design",
			"hinweis": "Das Label beschreibt, was eingeschaltet wird — nicht nur die Kategorie."
		}
	],
	"version": "Figma-Node 2845:5966",
	"verwandt": [
		"checkbox",
		"input"
	],
	"variantInfo": {
		"Off": "Ausgeschaltet — Track in Background-20, Thumb links.",
		"On": "Eingeschaltet — Track in Text-100, Thumb rechts."
	}
}
