{
	"zweck": "Teaser-Zelle für Content-Listen und Navigations-Menüs. Ein gemeinsames Grundgerüst (Fläche · Spitzmarke · Titel · Byline · Meta) in mehreren Typen — Article, Headline, Artikel, Author, Podcast Series, Anzeige und Pinned — jeweils als Wide oder Small.",
	"status": "ready_for_dev",
	"beispiele": [
		{
			"titel": "Die drei Listen-Typen",
			"beschreibung": "Dasselbe Grundgerüst, drei redaktionelle Absichten: Artikel ist der vollständige Teaser mit Bild, Spitzmarke, Titel und Byline. Article ist die eintreffende Schlagzeile — hier gehört möglichst ein Zeitstempel dazu. Headline reduziert auf den Titel und setzt eine Trennlinie darüber.",
			"instanzen": [
				{
					"type": "artikel"
				},
				{
					"type": "article"
				},
				{
					"type": "headline"
				}
			],
			"abdeckt": ["Artikel", "Article", "Headline", "Wide"]
		},
		{
			"titel": "Im Navigationsmenü",
			"beschreibung": "Pinned steht für regelmäßig aktualisierte oder empfohlene Inhalte im Menü — Dashboards, Karten, Center-Pages. Der Platz ist knapp: Spitzmarke und Titel kurz halten, sonst bricht die Zeile.",
			"instanzen": [
				{
					"type": "pinned"
				}
			],
			"abdeckt": ["Pinned"]
		},
		{
			"titel": "Menschen und Serien",
			"beschreibung": "Author zeigt statt eines Motivs einen runden Avatar; die Spitzmarke entfällt, die Byline bleibt (im Produkt: Name und Funktion). Podcast Series stellt das farbige Cover daneben. Beide teilen dieselbe Zelle — was sie unterscheidet, ist welche Bestandteile sichtbar bleiben.",
			"instanzen": [
				{
					"type": "author"
				},
				{
					"type": "podcast-series"
				}
			],
			"abdeckt": ["Author", "Podcast Series"]
		},
		{
			"titel": "Werblicher Platz",
			"beschreibung": "Anzeige sitzt auf getönter Fläche und ersetzt die redaktionelle Spitzmarke durch ein Versal-Label. Die Tönung ist die Kennzeichnung — sie darf nicht wegfallen, nur weil das Umfeld schon hell ist.",
			"instanzen": [
				{
					"type": "anzeige"
				}
			],
			"abdeckt": ["Anzeige"]
		},
		{
			"titel": "Kompakte Fassung",
			"beschreibung": "Small verkleinert Titel und Fläche, ohne den Aufbau zu ändern — für dichte Spalten. Der Typ bleibt frei wählbar; die Größe ist eine zweite, unabhängige Achse.",
			"instanzen": [
				{
					"type": "artikel",
					"small": true
				}
			],
			"abdeckt": ["Small"]
		}
	],
	"callouts": [
		{
			"nr": 1,
			"text": "Fläche — Bild bzw. Podcast-Cover, 84×84 (Small 72), Radius 4; beim Author ein runder Avatar."
		},
		{
			"nr": 2,
			"text": "Spitzmarke (Kicker) — redaktionelle Kategorie in Akzentrot (#b91109), Tablet Gothic 14."
		},
		{
			"nr": 3,
			"text": "Titel — Tablet Gothic Bold 20/1.2 (Small 18; Pinned/Anzeige 16)."
		},
		{
			"nr": 4,
			"text": "Byline / Meta — Zeitstempel und Autor in Text-55 (#69696c), 14/1.5."
		}
	],
	"a11y": [
		{
			"label": "Struktur",
			"wert": "Pro Teaser ein <article>; die gesamte Zelle als ein Link (a) umsetzen, nicht mehrere.",
			"status": "warn"
		},
		{
			"label": "Überschrift",
			"wert": "Titel je Kontext als <h2>/<h3> — nicht optisch fälschen.",
			"status": "warn"
		},
		{
			"label": "Spitzmarke",
			"wert": "Kicker ist redaktionelle Kategorie, keine Überschrift — als <p>/<span> auszeichnen.",
			"status": "pass"
		},
		{
			"label": "Kontrast Titel",
			"wert": "#252525 auf #ffffff ≈ 15:1 · AAA",
			"status": "pass"
		},
		{
			"label": "Kontrast Meta",
			"wert": "#69696c auf #ffffff ≈ 4.9:1 · AA",
			"status": "pass"
		},
		{
			"label": "Fläche",
			"wert": "Cover/Avatar brauchen alt-Text; rein dekorative Flächen aria-hidden.",
			"status": "warn"
		}
	],
	"doDont": {
		"do": [
			"Bei Pinned Spitzmarke und Headline kurz halten — der Platz ist begrenzt.",
			"Bei Article möglichst einen Zeitstempel zeigen (Aktualität)."
		],
		"dont": [
			"Nicht mehrere Links pro Zelle — die gesamte Zelle ist ein Ziel.",
			"Spitzmarke nicht als Überschrift auszeichnen."
		]
	},
	"verwendung": {
		"nutzen": [
			"In Navigations-Menüs für regelmäßig aktualisierte Inhalte (Pinned): Dashboards, Karten, empfohlene Center-Pages.",
			"Für aktuelle Schlagzeilen, die gerade eintreffen (Article) — mit Zeitstempel."
		],
		"nichtNutzen": [
			"Nicht für einzelne Aktionen — dafür Button / Text Button.",
			"Pinned nicht mit langen Titeln überfrachten (begrenzter Platz)."
		]
	},
	"wording": [
		{
			"schlecht": "Artikel",
			"gut": "Streit ums Bürgergeld: Was die Reform wirklich ändert",
			"hinweis": "Der Titel ist eine konkrete Schlagzeile, kein Platzhalter."
		},
		{
			"schlecht": "NEWS",
			"gut": "Wirtschaft",
			"hinweis": "Die Spitzmarke ist die Ressort-/Kategorie — kurz, in normaler Schreibung, nicht in Versalien."
		},
		{
			"schlecht": "Von der Redaktion",
			"gut": "Von Anna Schmidt",
			"hinweis": "Die Byline nennt Autor:innen namentlich, wenn möglich."
		}
	],
	"version": "Figma-Node 4388:32445",
	"playground": {
		"align": "fill",
		"resizable": true
	},
	"variantInfo": {
		"Pinned": "In Navigations-Menüs für regelmäßig aktualisierte oder empfohlene Inhalte — Platz begrenzt.",
		"Article": "Aktuelle Schlagzeilen, die gerade eintreffen — Zeitstempel bevorzugt.",
		"Headline": "Reduziert auf den Titel, oben mit Trennlinie.",
		"Artikel": "Standard-Teaser mit Bild, Spitzmarke, Titel und Byline.",
		"Author": "Autor/Autorin mit rundem Avatar, Name und Funktion.",
		"Podcast Series": "Podcast-Serie mit farbigem Cover, Titel und Abo-Hinweis.",
		"Anzeige": "Werblicher Teaser auf getönter Fläche mit Versal-Label.",
		"Wide": "Standardbreite (343).",
		"Small": "Kompakt — kleinerer Titel und kleinere Fläche."
	}
}
