{
	"zweck": "Dezenter, flächenloser Text-Button für sekundäre Aktionen — mit Größen- und Betonungs-Modifiern sowie einer On-Image-Variante für Flächen auf Bildern.",
	"status": "ready_for_dev",
	"beispiele": [
		{
			"titel": "Die nachrangige Aktion",
			"beschreibung": "Ohne Fläche, ohne Rahmen: Der Text Button steht neben einer wichtigeren Aktion und nimmt ihr nichts weg. Das Label benennt die Aktion konkret — „Mehr anzeigen“ statt „Mehr“.",
			"instanzen": [{}],
			"abdeckt": ["Default"]
		},
		{
			"titel": "Dichte oder Prominenz",
			"beschreibung": "Slim spart 2 px Höhe je Seite und ist für dichte Layouts gedacht — Listen, Toolbars, Teaser-Zeilen. Large geht den umgekehrten Weg (Label 16 statt 14), wenn die Aktion mehr Gewicht verträgt.",
			"instanzen": [
				{
					"size": "slim"
				},
				{
					"size": "large"
				}
			],
			"abdeckt": ["Slim", "Large"]
		},
		{
			"titel": "Betont und aktiv",
			"beschreibung": "Bold betont das Label innerhalb einer Gruppe gleichrangiger Aktionen. Active ist kein Hover, sondern ein bleibender Zustand: der gerade ausgewählte Eintrag, hinterlegt mit Background-10.",
			"instanzen": [
				{
					"bold": true
				},
				{
					"active": true
				}
			],
			"abdeckt": ["Bold", "Active"]
		}
	],
	"verwandt": [
		"button",
		"icon-button"
	],
	"a11y": [
		{
			"label": "Rolle",
			"wert": "Als natives <button> umsetzen (Figma: Component) — trägt Rolle & Fokusverhalten selbst.",
			"status": "warn"
		},
		{
			"label": "Tastatur",
			"wert": "Enter / Leertaste lösen die Aktion nativ aus.",
			"status": "pass"
		},
		{
			"label": "Fokus",
			"wert": ":focus-visible zeichnet einen 2px-Outline in --z-ds-color-focus-100 (in der Pattern-CSS vorhanden).",
			"status": "pass"
		},
		{
			"label": "Kontrast Default",
			"wert": "Label Text/70 #444444 auf heller Fläche ≈ 9.7:1 · AAA",
			"status": "pass"
		},
		{
			"label": "Kontrast Disabled",
			"wert": "Label Text/55 #69696c auf Weiß ≈ 5.5:1 · AA — nur Disabled-State.",
			"status": "pass"
		},
		{
			"label": "Kontrast On Image",
			"wert": "General-White-60 hängt vom Bildhintergrund ab — nur auf ausreichend dunklen Flächen einsetzen.",
			"status": "warn"
		},
		{
			"label": "Touch-Target",
			"wert": "Content 18px + Padding ≈ 34px < 44px — für Touch ggf. Trefferfläche vergrößern.",
			"status": "warn"
		}
	],
	"tastatur": [
		{
			"taste": "Tab",
			"aktion": "Setzt den Fokus auf den Text-Button."
		},
		{
			"taste": "Enter / Leertaste",
			"aktion": "Löst die Aktion aus (nativ)."
		}
	],
	"doDont": {
		"do": [
			"Für nachrangige, dezente Aktionen neben einem primären Button einsetzen.",
			"Label als konkrete Aktion formulieren: „Mehr anzeigen“ statt „Mehr“."
		],
		"dont": [
			"Nicht als einzige oder wichtigste Aktion — dafür einen Button (Primary).",
			"On-Image-Variante nicht auf hellen/unruhigen Bildern nutzen — der Kontrast bricht ein."
		]
	},
	"verwendung": {
		"nutzen": [
			"Für flächenlose, dezente Aktionen in dichten Layouts (Listen, Toolbars, Teaser).",
			"Auf Bildern die On-Image-Variante für lesbaren Kontrast."
		],
		"nichtNutzen": [
			"Nicht für die Hauptaktion — dafür Button (Primary).",
			"Nicht für reine Navigation / Seitenwechsel — dafür einen Link."
		]
	},
	"variantInfo": {
		"Default": "Flächenloser Text-Button in Tablet Gothic 14 — Standard für sekundäre Aktionen.",
		"Slim": "Reduzierte vertikale Höhe (6px statt 8px) für dichte Layouts.",
		"Large": "Größeres Label (Tablet Gothic 16) für prominentere Kontexte.",
		"Bold": "Fettes Label zur stärkeren Betonung.",
		"Active": "Persistenter Aktiv-Look (Background-10 + Text-100) — z. B. für den aktiven Eintrag.",
		"On Image": "Helle Beschriftung (General-White-60) für Flächen auf Bildern; Hover mit dunkler Fläche."
	},
	"callouts": [
		{
			"nr": 1,
			"text": "Container — natives <button>, flächenlos; Padding 8 (--z-ds-space-xs), Radius 4. Hover/Active legen Background-10 unter.",
			"art": "container"
		},
		{
			"nr": 2,
			"text": "Label — Tablet Gothic 14 (Large 16), Regular oder Bold; optionale Icon-Slots links (Leading) und rechts (Trailing), Gap 4.",
			"art": "text"
		}
	],
	"overrides": {
		"masse.hoehe.px": {
			"wert": "34",
			"grund": "Der Figma-Node hat Padding 0 und misst damit nur die Zeilenhöhe des Labels (18). Die ausgelieferte Komponente trägt Padding 8 aus der text-button.css — auf zeit.de/index messen alle Basis-Instanzen 34 (siehe produktion.referenzen).",
			"belegt": "produktion",
			"maschinenwert": "18"
		}
	}
}
