{
	"zweck": "Auswahlkästchen für eine An/Aus-Entscheidung oder Mehrfachauswahl. Zwei Achsen: ausgewählt (checked) und Interaktionszustand (Default, Hover, Focus, Disabled).",
	"status": "ready_for_dev",
	"beispiele": [
		{
			"titel": "Die beiden Antworten",
			"beschreibung": "Angehakt heißt: trifft zu. Beide Zustände müssen sich auch ohne Farbwahrnehmung unterscheiden lassen — deshalb trägt der ausgewählte Zustand den Haken und nicht nur die dunkle Füllung.",
			"instanzen": [
				{
					"checked": false
				},
				{
					"checked": true
				}
			],
			"abdeckt": ["Unchecked", "Checked"]
		}
	],
	"callouts": [
		{
			"nr": 1,
			"text": "Box — 16×16, Radius 2; Rahmen bzw. Füllung signalisieren den Zustand."
		},
		{
			"nr": 2,
			"text": "Haken — weiß, nur im checked-Zustand; Fokus als 2px-Rahmen in Focus-100."
		}
	],
	"a11y": [
		{
			"label": "Rolle",
			"wert": "Als natives <input type=checkbox> mit verknüpftem <label> umsetzen.",
			"status": "warn"
		},
		{
			"label": "Tastatur",
			"wert": "Leertaste schaltet um (nativ).",
			"status": "pass"
		},
		{
			"label": "Fokus",
			"wert": "Sichtbarer 2px-Fokus in Focus-100.",
			"status": "pass"
		},
		{
			"label": "Zielgröße",
			"wert": "16px Box — klickbare Fläche inkl. Label vergrößern (min. 24px).",
			"status": "warn"
		},
		{
			"label": "Kontrast",
			"wert": "Rahmen #cccccf auf #ffffff ≈ 1.5:1 — nur Rahmen, Zustand zusätzlich über Haken.",
			"status": "warn"
		}
	],
	"tastatur": [
		{
			"taste": "Tab",
			"aktion": "Setzt den Fokus auf die Checkbox."
		},
		{
			"taste": "Leertaste",
			"aktion": "Schaltet die Auswahl um (checked ↔ unchecked)."
		}
	],
	"doDont": {
		"do": [
			"Immer mit klickbarem Label kombinieren.",
			"Für unabhängige An/Aus-Optionen oder Mehrfachauswahl nutzen."
		],
		"dont": [
			"Nicht für sich gegenseitig ausschließende Optionen — dafür Radio-Buttons.",
			"Zustand nicht allein über Farbe kommunizieren."
		]
	},
	"verwendung": {
		"nutzen": [
			"Mehrere unabhängige Optionen, die einzeln an/aus sein können.",
			"Zustimmung/Bestätigung (AGB akzeptiert)."
		],
		"nichtNutzen": [
			"Genau eine Option aus mehreren — dafür Radio.",
			"Sofort wirksame Ein/Aus-Einstellung — dafür Toggle."
		]
	},
	"wording": [
		{
			"schlecht": "Benachrichtigungen nicht deaktivieren",
			"gut": "Benachrichtigungen erhalten",
			"hinweis": "Checkbox-Labels positiv formulieren — angehakt = zutreffend."
		}
	],
	"komposition": [
		"Immer mit nativem <input type=checkbox> + <label> verdrahten — siehe Code-Beispiele."
	],
	"codeBeispiele": [
		{
			"label": "Natives Wiring (Empfehlung der Doku)",
			"sprache": "html",
			"hinweis": "Empfehlung der Doku, nicht offizielles DS-Markup: Das Pattern (.z-checkbox + Modifier) liefert nur die Optik. Fürs echte Verhalten ein verstecktes natives <input type=checkbox> mit <label> verdrahten — Zustände (checked/focus/disabled) kommen dann nativ, nicht über State-Klassen. Die Hilfsklassen liegen bewusst außerhalb des z-*-Namespace (der gehört dem DS).",
			"code": "<!-- Verstecktes natives <input> steuert die Optik; <label> macht die ganze Fläche klickbar. -->\n<label class=\"checkbox-field\">\n  <input type=\"checkbox\" class=\"checkbox-native\" />\n  <span class=\"z-checkbox\" aria-hidden=\"true\">\n    <span class=\"z-checkbox__check\"></span>\n  </span>\n  Benachrichtigungen erhalten\n</label>"
		},
		{
			"label": "Natives Wiring — Zustands-Kopplung (CSS)",
			"sprache": "css",
			"hinweis": "Koppelt die nativen Pseudoklassen (:checked, :focus-visible, :hover, :disabled) an die dokumentierten Token-Looks. Die Modifier-Klassen des Patterns (.z-checkbox--checked …) bleiben die Referenz-Optik; hier werden sie durch native Zustände ersetzt. Nur dokumentierte --z-ds-*-Tokens.",
			"code": "/* Natives <input> steuert die dokumentierte Optik über Pseudoklassen —\n   die Modifier-Klassen (.z-checkbox--*) werden hier NICHT gesetzt. */\n.checkbox-field {\n  display: inline-flex;\n  align-items: center;\n  gap: var(--z-ds-space-8);\n  cursor: pointer;\n}\n\n/* Natives Steuerelement visuell verstecken, aber fokussier- und bedienbar lassen. */\n.checkbox-native {\n  position: absolute;\n  width: 16px;\n  height: 16px;\n  margin: 0;\n  opacity: 0;\n}\n\n/* Hover wie .z-checkbox--hover. */\n.checkbox-native:hover ~ .z-checkbox {\n  background-color: var(--z-ds-color-background-10);\n}\n\n/* Tastaturfokus wie .z-checkbox--focus: 2px-Rahmen in Focus-100. */\n.checkbox-native:focus-visible ~ .z-checkbox {\n  border: 2px solid var(--z-ds-color-focus-100);\n}\n\n/* Checked wie .z-checkbox--checked: dunkle Füllung, Haken sichtbar. */\n.checkbox-native:checked ~ .z-checkbox {\n  background-color: var(--z-ds-color-text-100);\n  border-color: var(--z-ds-color-text-100);\n}\n.checkbox-native:checked ~ .z-checkbox .z-checkbox__check {\n  display: block;\n}\n\n/* Disabled wie .z-checkbox--disabled. */\n.checkbox-native:disabled ~ .z-checkbox {\n  border-color: var(--z-ds-color-border-70);\n}\n.checkbox-native:checked:disabled ~ .z-checkbox {\n  background-color: var(--z-ds-color-text-40);\n  border-color: var(--z-ds-color-text-40);\n}"
		}
	],
	"version": "Figma-Node 973:945",
	"verwandt": ["toggle", "input"],
	"variantInfo": {
		"Unchecked": "Nicht ausgewählt.",
		"Checked": "Ausgewählt — dunkle Füllung mit weißem Haken.",
		"Default": "Ruhezustand.",
		"Hover": "Mauszeiger darüber.",
		"Focus": "Tastaturfokus — 2px-Rahmen in Focus-100.",
		"Disabled": "Gesperrt — gedämpft."
	}
}
